Item ID,Short Name,Assessment Instrument,Assessment Instrument Version,HIT Standard Name,HIT Standard Version,Item HIT Code,Item HIT Text,Item Subsets,Response HIT Code,Assessment Response Codes,Response HIT Text
M2001,Drug regimen review,OASIS,C2-012017,LOINC,2.63,57255-2,Drug regimen review identified potential medication issues [CMS Assessment],01|03,LA27634-7|LA27635-4|LA27636-2,0|1|9,No - No issues found during review|Yes - Issues found during review|NA - Patient is not taking any medications
M2003,Medication follow-up,OASIS,C2-012017,LOINC,2.63,57281-8,Medication follow-up [CMS Assessment],01|03,LA32-8|LA33-6,0|1,No|Yes
M2005,Medication intervention,OASIS,C2-012017,LOINC,2.63,57256-0,Medication intervention [CMS Assessment],06|07|08|09,LA27681-8|LA32-8|LA33-6,9|0|1,NA - There were no clinically significant medication issues identified since SOC/ROC or patient is not taking any medications|No|Yes
M2010,{Patient/resident}/caregiver high risk drug education,OASIS,C2-012017,LOINC,2.63,57257-8,Patient/caregiver received high risk drug education [CMS Assessment],01|03,LA12317-6|LA32-8|LA33-6,NA|00|01,Patient not taking any high risk drugs OR patient/caregiver fully knowledgeable about special precautions associated with all high-risk medications|No|Yes
M2016,{Patient/resident}/caregiver drug education intervention,OASIS,C2-012017,LOINC,2.63,57195-0,Patient/caregiver drug education intervention [CMS Assessment],06|07|09,LA12320-0|LA32-8|LA33-6,NA|00|01,Patient not taking any drugs|No|Yes
M2020,Current: management of oral medications,OASIS,C2-012017,LOINC,2.63,57285-9,Management of oral medications - ability [CMS Assessment],01|03|09,LA12322-6|LA12323-4|LA12324-2|LA6135-3|LA6290-6,01|02|03|00|NA,Able to take medication(s) at the correct times if: (a) individual dosages are prepared in advance by another person; or (b) another person develops a drug diary or chart.|Able to take medication(s) at the correct times if given reminders by another person at the appropriate times|Unable to take medication unless administered by another person.|Able to independently take the correct oral medication(s) and proper dosage(s) at the correct times.|No oral medications prescribed.
M2030,Current: management of injectable medications,OASIS,C2-012017,LOINC,2.63,57284-2,Management of injectable medications - ability [CMS Assessment],01|03|04|05|09,LA12326-7|LA12327-5|LA12328-3|LA12329-1|LA6280-7,00|01|02|03|NA,Able to independently take the correct medication(s) and proper dosage(s) at the correct times.|Able to take injectable medication(s) at the correct times if: (a) individual syringes are prepared in advance by another person; or (b) another person develops a drug diary or chart.|Able to take medication(s) at the correct times if given reminders by another person based on the frequency of the injection|Unable to take injectable medication unless administered by another person.|No injectable medications prescribed.
M2040,Prior medication management,OASIS,C2-012017,LOINC,2.63,57196-8,Prior medication management [CMS Assessment],01|03,,,
M2040_A,Prior medication management: oral medications,OASIS,C2-012017,LOINC,2.63,57258-6,Oral medication management - prior ability [CMS Assessment],01|03,LA12302-8|LA12303-6|LA12304-4|LA4720-4,00|01|02|NA,Independent|Needed some help|Dependent|Not applicable
M2040_B,Prior medication management: injectable medications,OASIS,C2-012017,LOINC,2.63,57259-4,Injectable medication management - prior ability [CMS Assessment],01|03,LA12302-8|LA12303-6|LA12304-4|LA4720-4,00|01|02|NA,Independent|Needed some help|Dependent|Not applicable
M2102,Types and sources of assistance,OASIS,C2-012017,LOINC,2.63,57306-3,Types and sources of assistance [CMS Assessment],01|03|09,,,
M2102_A,"Care management, types/sources: ADL",OASIS,C2-012017,LOINC,2.63,57260-2,Non-agency caregiver ability and willingness to assist with ADL [CMS Assessment],01|03|09,LA27608-1|LA27610-7|LA27611-5|LA27612-3|LA27613-1,00|01|02|03|04,"No assistance needed - patient is independent or does not have needs in this area|Non-agency caregiver(s) currently provide assistance|Non-agency caregiver(s) need training/supportive services to provide assistance|Non-agency caregiver(s) are not likely to provide assistance OR it is unclear if they will provide assistance|Assistance needed, but no non-agency caregiver(s) available"
M2102_B,"Care management, types/sources: IADL",OASIS,C2-012017,LOINC,2.63,57261-0,Non-agency caregiver ability and willingness to assist with IADL [CMS Assessment],01|03|09,LA27608-1|LA27610-7|LA27611-5|LA27612-3|LA27613-1,00|01|02|03|04,"No assistance needed - patient is independent or does not have needs in this area|Non-agency caregiver(s) currently provide assistance|Non-agency caregiver(s) need training/supportive services to provide assistance|Non-agency caregiver(s) are not likely to provide assistance OR it is unclear if they will provide assistance|Assistance needed, but no non-agency caregiver(s) available"
M2102_C,"Care management, types/sources: medication administration",OASIS,C2-012017,LOINC,2.63,57262-8,Non-agency caregiver ability and willingness to assist with medication administration [CMS Assessment],01|03|09,LA27608-1|LA27610-7|LA27611-5|LA27612-3|LA27613-1,00|01|02|03|04,"No assistance needed - patient is independent or does not have needs in this area|Non-agency caregiver(s) currently provide assistance|Non-agency caregiver(s) need training/supportive services to provide assistance|Non-agency caregiver(s) are not likely to provide assistance OR it is unclear if they will provide assistance|Assistance needed, but no non-agency caregiver(s) available"
M2102_D,"Care management, types/sources: medical procedures/treatments",OASIS,C2-012017,LOINC,2.63,57263-6,Non-agency caregiver ability and willingness to assist with medication procedures/treatments [CMS Assessment],01|03|09,LA27608-1|LA27610-7|LA27611-5|LA27612-3|LA27613-1,00|01|02|03|04,"No assistance needed - patient is independent or does not have needs in this area|Non-agency caregiver(s) currently provide assistance|Non-agency caregiver(s) need training/supportive services to provide assistance|Non-agency caregiver(s) are not likely to provide assistance OR it is unclear if they will provide assistance|Assistance needed, but no non-agency caregiver(s) available"
M2102_E,"Care management, types/sources: equipment",OASIS,C2-012017,LOINC,2.63,57264-4,Non-agency caregiver ability and willingness to assist with management of equipment [CMS Assessment],01|03|09,LA27608-1|LA27610-7|LA27611-5|LA27612-3|LA27613-1,00|01|02|03|04,"No assistance needed - patient is independent or does not have needs in this area|Non-agency caregiver(s) currently provide assistance|Non-agency caregiver(s) need training/supportive services to provide assistance|Non-agency caregiver(s) are not likely to provide assistance OR it is unclear if they will provide assistance|Assistance needed, but no non-agency caregiver(s) available"
M2102_F,"Care management, types/sources: supervision and safety",OASIS,C2-012017,LOINC,2.63,57265-1,Non-agency caregiver ability and willingness to assist with supervision and safety [CMS Assessment],01|03|09,LA27608-1|LA27610-7|LA27611-5|LA27612-3|LA27613-1,00|01|02|03|04,"No assistance needed - patient is independent or does not have needs in this area|Non-agency caregiver(s) currently provide assistance|Non-agency caregiver(s) need training/supportive services to provide assistance|Non-agency caregiver(s) are not likely to provide assistance OR it is unclear if they will provide assistance|Assistance needed, but no non-agency caregiver(s) available"
M2102_G,"Care management, types/sources: advocacy or facilitation",OASIS,C2-012017,LOINC,2.63,57266-9,Non-agency caregiver ability and willingness to assist with advocacy or facilitation of patient participation [CMS Assessment],01|03|09,LA27608-1|LA27610-7|LA27611-5|LA27612-3|LA27613-1,00|01|02|03|04,"No assistance needed - patient is independent or does not have needs in this area|Non-agency caregiver(s) currently provide assistance|Non-agency caregiver(s) need training/supportive services to provide assistance|Non-agency caregiver(s) are not likely to provide assistance OR it is unclear if they will provide assistance|Assistance needed, but no non-agency caregiver(s) available"
M2110,How often receive non-HHA caregiver ADL/IADL assistance,OASIS,C2-012017,LOINC,2.63,57267-7,ADL or IADL assistance frequency from any caregiver [CMS Assessment],01|03,LA12344-0|LA12345-7|LA4489-6|LA6157-7|LA6308-6|LA6396-1,04|05|UK|01|03|02,"Received, but less often than weekly|No assistance received|Unknown|At least daily|One to two times per week|Three or more times per week"
M2200,Therapy need: number of visits indicated,OASIS,C2-012017,LOINC,2.63,57268-5,Therapy need # [CMS Assessment],01|03|04|05,,,
M2250,Plan of care synopsis,OASIS,C2-012017,LOINC,2.63,57197-6,Plan of care synopsis [CMS Assessment],01|03,,,
M2250_A,Plan of care synopsis: {patient/resident} specific parameters,OASIS,C2-012017,LOINC,2.63,57269-3,Plan of care includes patient-specific parameters for notifying physician of changes [CMS Assessment],01|03,LA26737-0|LA32-8|LA33-6,NA|00|01,NA - Physician has chosen not to establish patient-specific parameters for this patient. Agency will use standardized clinical guidelines accessible for all care providers to reference.|No|Yes
M2250_B,Plan of care synopsis: diabetic foot care,OASIS,C2-012017,LOINC,2.63,57270-1,Plan of care includes diabetic foot care [CMS Assessment],01|03,LA27638-8|LA32-8|LA33-6,NA|00|01,NA - Patient is not diabetic or is missing lower legs due to congenital or acquired condition (bilateral amputee))|No|Yes
M2250_C,Plan of care synopsis: falls prevention,OASIS,C2-012017,LOINC,2.63,57271-9,Plan of care includes fall prevention interventions [CMS Assessment],01|03,LA27639-6|LA32-8|LA33-6,NA|00|01,NA - Falls risk assessment indicated patient has no risk for falls|No|Yes
M2250_D,Plan of care synopsis: depression interventions,OASIS,C2-012017,LOINC,2.63,57272-7,Plan of care includes depression intervention [CMS Assessment],01|03,LA27640-4|LA32-8|LA33-6,NA|00|01,NA - Patient has no diagnosis of depression AND depression screening indicates patient has: 1) no symptoms of depression; or 2) has some symptoms of depression but does not meet criteria for further evaluation of depression based on screening tool used|No|Yes
M2250_E,Plan of care synopsis: pain interventions,OASIS,C2-012017,LOINC,2.63,57273-5,Plan of care includes intervention to monitor and mitigate pain [CMS Assessment],01|03,LA27641-2|LA32-8|LA33-6,NA|00|01,NA - Pain assessment indicates patient has no pain.|No|Yes
M2250_F,Plan of care synopsis: pressure ulcer prevention,OASIS,C2-012017,LOINC,2.63,57274-3,Plan of care includes intervention to prevent pressure ulcers [CMS Assessment],01|03,LA27642-0|LA32-8|LA33-6,NA|00|01,NA - Pressure ulcer risk assessment (clinical or formal) indicates patient is not at risk of developing pressure ulcers.|No|Yes
M2250_G,Plan of care synopsis: pressure ulcer moist treatment,OASIS,C2-012017,LOINC,2.63,57275-0,Plan of care includes pressure ulcer treatment - moist healing [CMS Assessment],01|03,LA27643-8|LA32-8|LA33-6,NA|00|01,NA - Patient has no pressure ulcers OR has no pressure ulcers for which moist wound healing is indicated.|No|Yes
M2301,Emergent care: use since most recent SOC/ROC,OASIS,C2-012017,LOINC,2.63,57276-8,Emergent care utilized [CMS Assessment],06|07|09,LA12351-5|LA12352-3|LA32-8|LA4489-6,01|02|00|UK,"Yes, used hospital emergency department WITHOUT hospital admission|Yes, used hospital emergency department WITH hospital admission|No|Unknown"
M2310,Reason for emergent care. Check all that apply,OASIS,C2-012017,LOINC,2.63,57277-6,Reason for emergent care [CMS Assessment],06|07|09,LA12355-6|LA12356-4|LA12357-2|LA12358-0|LA12359-8|LA12360-6|LA12361-4|LA12362-2|LA12364-8|LA12365-5|LA12367-1|LA12368-9|LA12370-5|LA27773-3|LA4394-8|LA6180-9|LA6223-7|LA6315-1|LA6430-8|LA6437-3,2|3|4|5|6|7|8|9|11|12|14|15|17|1|UK|18|10|19|16|13,"Injury caused by fall|Respiratory infection (for example, pneumonia, bronchitis)|Other respiratory problem|Heart failure (for example, fluid overload)|Cardiac dysrhythmia (irregular heartbeat)|Myocardial infarction or chest pain|Other heart disease|Stroke (CVA) or TIA|GI bleeding, obstruction, constipation, impaction|Dehydration, malnutrition|IV catheter-related infection or complication|Wound infection or deterioration|Acute mental/behavioral health problem|Improper medication administration, adverse drug reactions, medication side effects, toxicity, anaphylaxis|Reason unknown|Deep vein thrombosis, pulmonary embolus|Hypo/hyperglycemia, diabetes out of control|Other than above reasons|Uncontrolled pain|Urinary tract infection"
M2401,Intervention synopsis,OASIS,C2-012017,LOINC,2.63,57198-4,Intervention synopsis,06|07|09,,,
M2401_A,Intervention synopsis: diabetic foot care,OASIS,C2-012017,LOINC,2.63,57270-1,Plan of care includes diabetic foot care [CMS Assessment],06|07|09,LA27638-8|LA32-8|LA33-6,NA|00|01,NA - Patient is not diabetic or is missing lower legs due to congenital or acquired condition (bilateral amputee)|No|Yes
M2401_B,Intervention synopsis: falls prevention,OASIS,C2-012017,LOINC,2.63,57271-9,Plan of care includes fall prevention interventions [CMS Assessment],06|07|09,LA27694-1|LA32-8|LA33-6,NA|00|01,"NA - Every standardized, validated multifactor fall risk assessment conducted at or since the most recent SOC/ROC assessment indicates the patient has no risk for falls.|No|Yes"
M2401_C,Intervention synopsis: depression intervention,OASIS,C2-012017,LOINC,2.63,57272-7,Plan of care includes depression intervention [CMS Assessment],06|07|09,LA27695-8|LA32-8|LA33-6,NA|00|01,"NA - Patient has no diagnosis of depression AND every standardized, validated depression screening conducted at or since the most recent SOC/ROC assessment indicates the patient has: 1) no symptoms of depression; or 2) has some symptoms of depression but does not meet criteria for further evaluation of depression based on screening tool|No|Yes"
M2401_D,Intervention synopsis: monitor and mitigate pain,OASIS,C2-012017,LOINC,2.63,57273-5,Plan of care includes intervention to monitor and mitigate pain [CMS Assessment],06|07|09,LA27696-6|LA32-8|LA33-6,NA|00|01,"NA - Every standardized, validated pain assessment conducted at or since the most recent SOC/ROC assessment indicates the patient has no pain.|No|Yes"
M2401_E,Intervention synopsis: prevent pressure ulcers,OASIS,C2-012017,LOINC,2.63,57274-3,Plan of care includes intervention to prevent pressure ulcers [CMS Assessment],06|07|09,LA27697-4|LA32-8|LA33-6,NA|00|01,"NA - Every standardized, validated pressure ulcer risk assessment conducted at or since the most recent SOC/ROC assessment indicates the patient is not at risk of developing pressure ulcers.|No|Yes"
M2401_F,Intervention synopsis: pressure ulcer moist wound treatment,OASIS,C2-012017,LOINC,2.63,57275-0,Plan of care includes pressure ulcer treatment - moist healing [CMS Assessment],06|07|09,LA27643-8|LA32-8|LA33-6,NA|00|01,NA - Patient has no pressure ulcers OR has no pressure ulcers for which moist wound healing is indicated.|No|Yes
M2410,Inpatient {facility/provider},OASIS,C2-012017,LOINC,2.63,46578-1,Admitted to Inpatient facility [CMS Assessment],06|07|09,LA27-8|LA6216-1|LA6218-7|LA6281-5|LA6357-3,03|04|01|NA|02,Nursing home|Hospice|Hospital|No inpatient facility admission|Rehabilitation facility
M2420,Discharge disposition,OASIS,C2-012017,LOINC,2.63,57278-4,Discharge disposition [CMS Assessment],9,LA12374-7|LA12375-4|LA12376-2|LA6316-9|LA6431-6,01|02|03|UK|04,Patient remained in the community (without formal assistive services)|Patient remained in the community (with formal assistive services)|Patient transferred to a non-institutional hospice|Other unknown|Unknown because patient moved to a geographic location not served by this agency
M2430,Reason for hospitalization. Check all that apply,OASIS,C2-012017,LOINC,2.63,57279-2,Reason for hospitalization [CMS Assessment],06|07,LA12355-6|LA12356-4|LA12357-2|LA12358-0|LA12359-8|LA12360-6|LA12361-4|LA12362-2|LA12364-8|LA12365-5|LA12367-1|LA12368-9|LA12370-5|LA12397-8|LA4394-8|LA6180-9|LA6223-7|LA6229-4|LA6315-1|LA6430-8|LA6437-3,2|3|4|5|6|7|8|9|11|12|14|15|17|19|UK|18|10|1|20|16|13,"Injury caused by fall|Respiratory infection (for example, pneumonia, bronchitis)|Other respiratory problem|Heart failure (for example, fluid overload)|Cardiac dysrhythmia (irregular heartbeat)|Myocardial infarction or chest pain|Other heart disease|Stroke (CVA) or TIA|GI bleeding, obstruction, constipation, impaction|Dehydration, malnutrition|IV catheter-related infection or complication|Wound infection or deterioration|Acute mental/behavioral health problem|Scheduled treatment or procedure|Reason unknown|Deep vein thrombosis, pulmonary embolus|Hypo/hyperglycemia, diabetes out of control|Improper medication administration, medication side effects, toxicity, anaphylaxis|Other than above reasons|Uncontrolled pain|Urinary tract infection"